Command:
tcpdump -n -i eth0

Output:
tcpdump: verbose output suppressed, use -v[v]... for full protocol decode
listening on eth0, link-type EN10MB (Ethernet), snapshot length 262144 bytes
21:20:09.664936 IP 159.203.26.25.22 > 99.241.251.227.54509: Flags [P.], seq 4231878310:4231878418, ack 1190823213, win 460, length 108
21:20:09.665031 IP 159.203.26.25.22 > 99.241.251.227.54509: Flags [P.], seq 108:224, ack 1, win 460, length 116
21:20:09.668438 IP 99.241.251.227.54509 > 159.203.26.25.22: Flags [.], ack 0, win 16493, length 0
21:20:09.677088 IP 99.241.251.227.54509 > 159.203.26.25.22: Flags [.], ack 224, win 16492, length 0
21:20:09.685730 IP 99.241.251.227.54509 > 159.203.26.25.22: Flags [P.], seq 1:37, ack 0, win 16493, length 36
21:20:09.685919 IP 159.203.26.25.22 > 99.241.251.227.54509: Flags [P.], seq 224:260, ack 37, win 460, length 36
21:20:09.707344 IP 99.241.251.227.54509 > 159.203.26.25.22: Flags [P.], seq 37:73, ack 260, win 16492, length 36
21:20:09.707645 IP 159.203.26.25.22 > 99.241.251.227.54509: Flags [P.], seq 260:296, ack 73, win 460, length 36
21:20:09.728966 IP 99.241.251.227.54509 > 159.203.26.25.22: Flags [P.], seq 73:109, ack 260, win 16492, length 36
21:20:09.729171 IP 159.203.26.25.22 > 99.241.251.227.54509: Flags [P.], seq 296:332, ack 109, win 460, length 36
21:20:09.746207 IP 99.241.251.227.54509 > 159.203.26.25.22: Flags [.], ack 332, win 16492, length 0
21:20:09.754857 IP 99.241.251.227.54509 > 159.203.26.25.22: Flags [P.], seq 109:145, ack 332, win 16492, length 36
21:20:09.755071 IP 159.203.26.25.22 > 99.241.251.227.54509: Flags [P.], seq 332:368, ack 145, win 460, length 36
21:20:09.763156 IP 159.203.26.25.22 > 99.241.251.227.54509: Flags [P.], seq 368:540, ack 145, win 460, length 172
21:20:09.763586 IP 159.203.26.25.22 > 99.241.251.227.54509: Flags [P.], seq 540:1568, ack 145, win 460, length 1028
21:20:09.763755 IP 159.203.26.25.22 > 99.241.251.227.54509: Flags [P.], seq 1568:1940, ack 145, win 460, length 372
21:20:09.767790 IP 99.241.251.227.54509 > 159.203.26.25.22: Flags [P.], seq 145:181, ack 332, win 16492, length 36
21:20:09.767959 IP 159.203.26.25.22 > 99.241.251.227.54509: Flags [P.], seq 1940:1976, ack 181, win 460, length 36
21:20:09.789479 IP 99.241.251.227.54509 > 159.203.26.25.22: Flags [.], ack 1940, win 16493, length 0
21:20:09.806679 IP 99.241.251.227.54509 > 159.203.26.25.22: Flags [P.], seq 181:217, ack 1976, win 16493, length 36
21:20:09.806906 IP 159.203.26.25.22 > 99.241.251.227.54509: Flags [P.], seq 1976:2012, ack 217, win 460, length 36
21:20:09.823984 IP 99.241.251.227.54509 > 159.203.26.25.22: Flags [P.], seq 217:253, ack 2012, win 16493, length 36
21:20:09.824204 IP 159.203.26.25.22 > 99.241.251.227.54509: Flags [P.], seq 2012:2048, ack 253, win 460, length 36
21:20:09.847730 IP 99.241.251.227.54509 > 159.203.26.25.22: Flags [P.], seq 253:289, ack 2048, win 16493, length 36
21:20:09.847926 IP 159.203.26.25.22 > 99.241.251.227.54509: Flags [P.], seq 2048:2084, ack 289, win 460, length 36
21:20:09.866838 IP 159.203.26.25.22 > 99.241.251.227.54509: Flags [P.], seq 2084:2240, ack 289, win 460, length 156
21:20:09.867158 IP 159.203.26.25.22 > 99.241.251.227.54509: Flags [P.], seq 2240:3540, ack 289, win 460, length 1300
21:20:09.867234 IP 159.203.26.25.22 > 99.241.251.227.54509: Flags [P.], seq 3540:3576, ack 289, win 460, length 36
21:20:09.873619 IP 99.241.251.227.54509 > 159.203.26.25.22: Flags [P.], seq 289:325, ack 2084, win 16492, length 36
21:20:09.874058 IP 159.203.26.25.22 > 99.241.251.227.54509: Flags [P.], seq 3576:3612, ack 325, win 460, length 36
21:20:09.908362 IP 99.241.251.227.54509 > 159.203.26.25.22: Flags [.], ack 3576, win 16493, length 0
21:20:09.908362 IP 99.241.251.227.54509 > 159.203.26.25.22: Flags [P.], seq 325:361, ack 3576, win 16493, length 36
21:20:09.908587 IP 159.203.26.25.22 > 99.241.251.227.54509: Flags [P.], seq 3612:3648, ack 361, win 460, length 36
21:20:09.931505 IP 99.241.251.227.54509 > 159.203.26.25.22: Flags [P.], seq 361:397, ack 3612, win 16493, length 36
21:20:09.931722 IP 159.203.26.25.22 > 99.241.251.227.54509: Flags [P.], seq 3648:3684, ack 397, win 460, length 36
21:20:09.949363 IP 99.241.251.227.54509 > 159.203.26.25.22: Flags [P.], seq 397:433, ack 3648, win 16493, length 36
21:20:09.949621 IP 159.203.26.25.22 > 99.241.251.227.54509: Flags [P.], seq 3684:3720, ack 433, win 460, length 36
21:20:09.966550 IP 99.241.251.227.54509 > 159.203.26.25.22: Flags [.], ack 3720, win 16492, length 0
^C
38 packets captured
54 packets received by filter
0 packets dropped by kernel
